<?xml version="1.0" encoding="UTF-8"?>
<NaturalPerson 
xmlns="http://eidas.europa.eu/attributes/naturalperson" 
xmlns:xsi="http://www.w3.org/2001/XMLSchema-instance" 
xmlns:eidas-np="http://eidas.europa.eu/attributes/naturalperson" 
xsi:schemaLocation="http://eidas.europa.eu/attributes/naturalperson https://ofn.gov.cz/společné-části-elektronických-dokumentů/2024-10-04/schémata/osoby/eIDASNaturalPerson.xsd">
	<FamilyName eidas-np:LatinScript="true">Smith</FamilyName>
	<FirstName eidas-np:LatinScript="true">John</FirstName>
	<DateOfBirth>1957-08-14</DateOfBirth>
	<PersonIdentifier>eidas999777888</PersonIdentifier>
	<BirthName eidas-np:LatinScript="true">Smith</BirthName>
	<PlaceOfBirth>London</PlaceOfBirth>
	<CurrentAddress>Berlin</CurrentAddress>
	<Gender>Unspecified</Gender>
	<Nationality>GB</Nationality>
	<CountryOfBirth>AT</CountryOfBirth>
	<TownOfBirth>Vienna</TownOfBirth>
	<CountryOfResidence>GB</CountryOfResidence>
	<PhoneNumber>+122233344-7</PhoneNumber>
	<EmailAddress>joh@smith.com</EmailAddress>
</NaturalPerson>
